{
  "schema_version": "1.0.0",
  "name": "ai-polish-skills",
  "description": "Oficjalny rejestr polskich skilli dla agentów AI (Claude Code, Cursor, Windsurf, Antigravity)",
  "homepage": "https://polskieskille.pl",
  "repository": "https://github.com/b44x/ai-polish-skills",
  "skills_count": 8,
  "categories": [
    {
      "name": "finance",
      "count": 2
    },
    {
      "name": "legal",
      "count": 2
    },
    {
      "name": "entertainment",
      "count": 1
    },
    {
      "name": "health",
      "count": 1
    },
    {
      "name": "logistics",
      "count": 1
    },
    {
      "name": "public_data",
      "count": 1
    }
  ],
  "skills": [
    {
      "name": "biala-lista",
      "display_name": "Biała Lista Podatników VAT",
      "version": "1.0.0",
      "description": "Check Polish businesses and VAT status in the official Ministry of Finance White List (Biała Lista Podatników VAT). Verify active VAT payer status (Czynny / Zwolniony / Niezarejestrowany), legal company name, REGON, KRS, registered address, and settlement bank accounts by NIP or REGON. Check if a contractor's bank account is on the whitelist before making B2B transfers (critical for split payment and tax deductibility above 15,000 PLN). Reverse-lookup company by 26-digit Polish bank account number (NRB/IBAN). Validate NIP, REGON, and IBAN checksums offline. Use whenever the user asks about NIP, REGON, Biała Lista VAT, \"sprawdź NIP\", \"sprawdź kontrahenta\", \"status VAT spółki\", \"czy numer konta jest na białej liście\", or verifying a Polish invoice.",
      "category": "finance",
      "language": "pl",
      "country": "PL",
      "license": "MIT",
      "author": "Michell Hoduń (https://github.com/b44x)",
      "repository": "https://github.com/b44x/ai-polish-skills",
      "network": true,
      "authentication": "none",
      "source": "Ministerstwo Finansów (KAS)",
      "source_type": "official_api",
      "official": true,
      "homepage": "https://www.podatki.gov.pl/wykaz-podatnikow-vat-wyszukiwarka/",
      "documentation": "https://www.gov.pl/web/kas/api-wykazu-podatnikow-vat",
      "rate_limit": "300 requests/day per IP",
      "last_verified": "2026-09-28",
      "tags": [
        "biala-lista",
        "vat",
        "nip",
        "regon",
        "split-payment",
        "podatki",
        "faktury",
        "rachunek-bankowy"
      ],
      "compatibility": "Python 3.8+ (standard library only); network access to wl-api.mf.gov.pl.",
      "entrypoint": "scripts/biala_lista.py",
      "skill_md_url": "https://raw.githubusercontent.com/b44x/ai-polish-skills/main/skills/biala-lista/SKILL.md",
      "install": {
        "curl": "curl -fsSL https://raw.githubusercontent.com/b44x/ai-polish-skills/main/install.sh | bash -s biala-lista",
        "cli": "python3 scripts/cli.py install biala-lista",
        "target_dir": ".agents/skills/biala-lista"
      },
      "files": [
        "SKILL.md",
        "references/output.md",
        "scripts/biala_lista.py"
      ]
    },
    {
      "name": "filmweb",
      "display_name": "Filmweb",
      "version": "1.0.0",
      "description": "Fetch film and TV series data from Filmweb.pl: search by title, rating and number of votes, critics rating, genres, duration, directors, cast, plot, premiere dates, where to watch (VOD providers and prices) and actor details. Use whenever the user asks about a movie or series on Filmweb, pastes a filmweb.pl link, or wants a Polish rating, opis, obsada or VOD info, e.g. \"ile Matrix ma na Filmwebie\", \"kto grał w…\", \"kto wyreżyserował…\", \"o czym jest…\", \"gdzie obejrzę…\", \"kiedy premiera…\", \"jaki serial…\", \"ocena serialu…\".",
      "category": "entertainment",
      "language": "pl",
      "country": "PL",
      "license": "MIT",
      "author": "Michell Hoduń (https://github.com/b44x)",
      "repository": "https://github.com/b44x/ai-polish-skills",
      "network": true,
      "authentication": "none",
      "source": "Filmweb.pl",
      "source_type": "unofficial_api",
      "official": false,
      "homepage": "https://www.filmweb.pl",
      "documentation": "none",
      "rate_limit": "fair use",
      "last_verified": "2026-09-28",
      "tags": [
        "filmweb",
        "filmy",
        "seriale",
        "kino",
        "vod",
        "recenzje",
        "obsada"
      ],
      "compatibility": "Python 3.8+ (standard library only); network access to www.filmweb.pl.",
      "entrypoint": "scripts/filmweb.py",
      "skill_md_url": "https://raw.githubusercontent.com/b44x/ai-polish-skills/main/skills/filmweb/SKILL.md",
      "install": {
        "curl": "curl -fsSL https://raw.githubusercontent.com/b44x/ai-polish-skills/main/install.sh | bash -s filmweb",
        "cli": "python3 scripts/cli.py install filmweb",
        "target_dir": ".agents/skills/filmweb"
      },
      "files": [
        "SKILL.md",
        "references/output.md",
        "scripts/filmweb.py"
      ]
    },
    {
      "name": "imgw",
      "display_name": "IMGW-PIB Pogoda i Ostrzeżenia",
      "version": "1.0.0",
      "description": "Fetch official meteorological and hydrological data for Poland from the Instytut Meteorologii i Gospodarki Wodnej (IMGW-PIB). Check current temperature, atmospheric pressure, humidity, wind speed and direction, and rainfall totals from synoptic stations (Warszawa, Kraków, Gdańsk, Zakopane and 58 others). Find the nearest weather station by GPS coordinates. Fetch official meteorological warnings (storms, gales, heat, frost) and hydrological warnings (hydrological drought, river water levels, alarm and warning levels on the Wisła, Odra, etc.). No API keys, 100% official public data. Use whenever the user asks about: \"pogoda IMGW\", \"jaka jest temperatura w Warszawie\", \"ostrzeżenia IMGW\", \"stan Wisły\", \"stan wody\", \"alerty pogodowe\", \"ciśnienie\", \"wiatr\", \"opady w Polsce\".",
      "category": "public_data",
      "language": "pl",
      "country": "PL",
      "license": "MIT",
      "author": "Michell Hoduń (https://github.com/b44x)",
      "repository": "https://github.com/b44x/ai-polish-skills",
      "network": true,
      "authentication": "none",
      "source": "Instytut Meteorologii i Gospodarki Wodnej (IMGW-PIB)",
      "source_type": "official_api",
      "official": true,
      "homepage": "https://imgw.pl",
      "documentation": "https://danepubliczne.imgw.pl/",
      "rate_limit": "fair use",
      "last_verified": "2026-09-28",
      "tags": [
        "imgw",
        "pogoda",
        "synop",
        "temperatura",
        "cisnienie",
        "wiatr",
        "opady",
        "ostrzezenia",
        "alerty",
        "hydro",
        "rzeki"
      ],
      "compatibility": "Python 3.8+ (standard library only); network access to danepubliczne.imgw.pl.",
      "entrypoint": "scripts/imgw.py",
      "skill_md_url": "https://raw.githubusercontent.com/b44x/ai-polish-skills/main/skills/imgw/SKILL.md",
      "install": {
        "curl": "curl -fsSL https://raw.githubusercontent.com/b44x/ai-polish-skills/main/install.sh | bash -s imgw",
        "cli": "python3 scripts/cli.py install imgw",
        "target_dir": ".agents/skills/imgw"
      },
      "files": [
        "SKILL.md",
        "references/output.md",
        "scripts/imgw.py"
      ]
    },
    {
      "name": "inpost",
      "display_name": "InPost & Paczkomaty",
      "version": "1.0.0",
      "description": "Track InPost shipments and find Paczkomat parcel lockers and pickup points across Poland. Check shipment status and historical events by 24-digit tracking number (e.g. \"gdzie moja paczka InPost\", \"status przesyłki\"). Look up Paczkomat locker details by code (e.g. WAW01M, KRA01A) including address, location description, 24/7 accessibility, easy access zone (Strefa Łatwego Dostępu), payment options, and photo. Search lockers by city, street, postal code, or find nearest Paczkomaty by GPS coordinates with distances in meters. Use whenever the user asks about an InPost parcel, Paczkomat location, \"gdzie jest paczkomat\", \"najbliższy paczkomat\", or pastes an InPost tracking link/number.",
      "category": "logistics",
      "language": "pl",
      "country": "PL",
      "license": "MIT",
      "author": "Michell Hoduń (https://github.com/b44x)",
      "repository": "https://github.com/b44x/ai-polish-skills",
      "network": true,
      "authentication": "none",
      "source": "InPost ShipX API",
      "source_type": "public_api",
      "official": false,
      "homepage": "https://inpost.pl",
      "documentation": "https://dokumentacja-inpost.atlassian.net/wiki/spaces/PL/pages/11731057/ShipX+API",
      "rate_limit": "fair use",
      "last_verified": "2026-09-28",
      "tags": [
        "inpost",
        "paczkomaty",
        "tracking",
        "przesylki",
        "kurier",
        "logistyka"
      ],
      "compatibility": "Python 3.8+ (standard library only); network access to api-shipx-pl.easypack24.net.",
      "entrypoint": "scripts/inpost.py",
      "skill_md_url": "https://raw.githubusercontent.com/b44x/ai-polish-skills/main/skills/inpost/SKILL.md",
      "install": {
        "curl": "curl -fsSL https://raw.githubusercontent.com/b44x/ai-polish-skills/main/install.sh | bash -s inpost",
        "cli": "python3 scripts/cli.py install inpost",
        "target_dir": ".agents/skills/inpost"
      },
      "files": [
        "SKILL.md",
        "references/output.md",
        "scripts/inpost.py"
      ]
    },
    {
      "name": "krs",
      "display_name": "Krajowy Rejestr Sądowy (KRS)",
      "version": "1.0.0",